{
  "id": "sp-4",
  "name": "Level 4 Chef",
  "hours": 135,
  "sideUnit": { "number": 104, "name": "Level 4 Chef recipes", "prefix": "D" },
  "units": [
    { "number": 1, "name": "Kitchen basics", "goal": "Cuts precisely at speed; weighs ingredients and works out yield; scales any recipe by hand; writes a prep timeline and runs it" },
    { "number": 2, "name": "No-cook", "goal": "Makes and rescues an emulsion; composes cold dishes for guests; holds a cold spread safely" },
    { "number": 3, "name": "Clean meat, poultry, and fish", "goal": "Breaks down a whole chicken and trims a cut; matches primal cuts to methods; buys and portions fish; works out yield and cost per serving; knows the clean birds and how to source meat well" },
    { "number": 4, "name": "Baking", "goal": "Makes enriched and cold-fermented doughs; laminates a rough puff; blind-bakes a crust; scales a quick bread and times it with a meal; judges a bake by feel and fixes what went wrong" },
    { "number": 5, "name": "Boiling, simmering, and steaming", "goal": "Poaches fish and eggs at a held temperature; makes risotto and grains for a crowd; costs a bean dish; reduces a stock and builds a soup from it" },
    { "number": 6, "name": "Stovetop", "goal": "Sears to doneness by touch and builds a pan sauce; times a multi-dish stir-fry; cooks eggs to order; builds a cuisine's base from scratch; makes the mother sauces and rescues a broken one; deep-fries at a held temperature" },
    { "number": 7, "name": "Oven and grill", "goal": "Roasts whole fish and fish in parchment for guests; grills over two zones; roasts a large cut to doneness with pan juices; bakes a casserole for 12, timing the oven for two pans" },
    { "number": 8, "name": "Low and slow", "goal": "Braises tough cuts to fork-tender and lifts off the fat; renders and saves poultry fat; builds a stew that holds safely for hours" },
    { "number": 9, "name": "Sabbath capstone", "goal": "Plans, budgets, shops for, and cooks a full Sabbath meal for the household and guests, entirely on their own, from dishes the student writes" }
  ],
  "weeks": [
    {
      "week": 1,
      "unit": 1,
      "skill": "dicing",
      "cuisine": "french",
      "familiar": "chicken-fried-rice",
      "explore": "ratatouille",
      "note": "Level 4 versions: every vegetable in brunoise; ratatouille cut evenly and precisely",
      "drill": {
        "title": "Timed brunoise",
        "minutes": 30,
        "body": ["A brunoise shows every flaw in your knife work. Today you time it, then check it."],
        "steps": [
          "Hone your chef's knife and set the board on a damp towel.",
          "Start a timer. Peel one carrot, square it into a block, and cut ⅛-inch planks, then ⅛-inch julienne, then ⅛-inch cubes.",
          "Stop the timer and write down the time.",
          "Spread 20 cubes on the board and measure a few with a ruler. Note how many are within a millimeter of ⅛ inch.",
          "Repeat with a second carrot and compare the time and the count.",
          "Weigh the trim and the brunoise. Save the trim for stock.",
          "Use the brunoise in this week's fried rice or ratatouille."
        ],
        "quiz": [
          { "q": "What comes before a brunoise?", "choices": ["A julienne", "A chiffonade", "A large dice"], "answer": 0, "explain": "Sticks become cubes." },
          { "q": "Which matters first, speed or evenness?", "choices": ["Evenness", "Speed", "Neither"], "answer": 0, "explain": "Speed follows even work." },
          { "q": "Why square the carrot into a block?", "choices": ["Flat sides make even planks and it can't roll", "It's faster", "It looks neater"], "answer": 0, "explain": "And the trim goes to stock." }
        ]
      },
      "knowledge": {
        "title": "Cuts by size: brunoise, small dice, batonnet, chiffonade; the French herb base",
        "minutes": 45,
        "body": [
          "Professional recipes name cuts by size, so every cook produces the same piece. Learn them as numbers.",
          "Brunoise: ⅛-inch cubes (3 mm), cut from a julienne. Small dice: ¼-inch cubes (6 mm), cut from a batonnet. Medium dice: ½ inch (12 mm). Large dice: ¾ inch (2 cm).",
          "Julienne: ⅛ by ⅛ inch, 2 to 2½ inches long. Batonnet: ¼ by ¼ inch, 2½ to 3 inches long. Chiffonade: leafy herbs or greens stacked, rolled tight, and sliced across into thin ribbons.",
          "Precision isn't decoration. Pieces of one size cook in the same time, so a pan of brunoise is done all at once, and a sauce built on it is smooth.",
          "French cooking builds on two aromatic foundations. Mirepoix is onion, carrot, and celery in a 2:1:1 ratio by weight, diced to suit the cooking time: brunoise for a quick sauce, large dice for a long stock. Herbs come as a bouquet garni, a bundle of thyme, bay leaf, and parsley stems tied together so it can be lifted out, or as fines herbes, parsley, chives, tarragon, and chervil, chopped fine and added at the end.",
          "Speed comes from repetition, not hurry. Keep the claw, let the blade do the work, and keep each cut the same before you try to make it faster."
        ],
        "quiz": [
          { "q": "What size is a brunoise?", "choices": ["⅛ inch", "¼ inch", "½ inch"], "answer": 0, "explain": "Cut from a julienne." },
          { "q": "A small dice is cut from which stick?", "choices": ["A batonnet", "A julienne", "A chiffonade"], "answer": 0, "explain": "¼-inch sticks cut across." },
          { "q": "What's the mirepoix ratio by weight?", "choices": ["2 onion : 1 carrot : 1 celery", "1:1:1", "1 onion : 2 carrot : 2 celery"], "answer": 0, "explain": "Onion is half." },
          { "q": "Why is a bouquet garni tied?", "choices": ["So it can be lifted out", "So it cooks faster", "For looks"], "answer": 0, "explain": "It flavors, then comes out." },
          { "q": "When do fines herbes go in?", "choices": ["At the end", "At the start", "In the marinade"], "answer": 0, "explain": "Delicate herbs lose flavor with long cooking." },
          { "q": "Why cut to an exact size?", "choices": ["Pieces of one size cook in the same time", "It's traditional", "It's faster"], "answer": 0, "explain": "Even cooking, even texture." }
        ]
      },
      "sabbath": {
        "title": "Prep every vegetable for a weekend meal",
        "minutes": 30,
        "body": [
          "A weekend meal is easier to serve when every vegetable is cut beforehand. Done right, the day itself is only cooking.",
          "Most firm vegetables keep 3 to 4 days cut: onions, carrots, celery, peppers, and squash, in sealed containers lined with paper towel. Tomatoes, cucumbers, potatoes, apples, and herbs are cut on the day, or held as noted: potatoes under cold water for up to a day, herbs whole in a damp towel."
        ],
        "steps": [
          "Choose the weekend menu and list every vegetable and its cut.",
          "Group the list by what keeps and what doesn't.",
          "Cut the keeping vegetables to the sizes the recipes need, each in its own lined container.",
          "Label each with the recipe, the cut, and the date.",
          "Write a short note of what's left to cut on the day, and how long it will take.",
          "After the meal, note what worked and what you'd change."
        ],
        "quiz": [
          { "q": "Which keeps well cut for several days?", "choices": ["Carrots", "Tomatoes", "Cucumbers"], "answer": 0, "explain": "Firm vegetables keep." },
          { "q": "How do cut potatoes wait?", "choices": ["Under cold water, up to a day", "In a dry container", "On the counter"], "answer": 0, "explain": "Air browns them." },
          { "q": "Why label each container with the recipe and cut?", "choices": ["So the day's cooking is only cooking", "For looks", "It's required"], "answer": 0, "explain": "No sorting on the day." }
        ]
      }
    },
    {
      "week": 2,
      "unit": 1,
      "skill": "measuring",
      "cuisine": "vietnamese",
      "familiar": "steak-fajitas",
      "explore": "bo-luc-lac",
      "drill": {
        "title": "Weigh vs. measure; weigh the trim to find the yield",
        "minutes": 30,
        "body": [
          "Today you'll see the difference between measuring and weighing with your own numbers, then find a real yield."
        ],
        "steps": [
          "Scoop 1 cup of flour three ways: scooped and packed, spooned and leveled, and sifted in. Weigh each and write it down.",
          "Measure 1 cup of water and weigh it. It should be close to 237 grams.",
          "Weigh a whole onion. Peel it, trim the root and top, and weigh it again. Work out the yield.",
          "Do the same with a bell pepper: weigh, core and seed, weigh again.",
          "Compare your yields with the Knowledge page's typical numbers.",
          "Keep the trim for stock."
        ],
        "quiz": [
          { "q": "1 cup of water weighs about:", "choices": ["237 g", "100 g", "500 g"], "answer": 0, "explain": "Water is about 1 g per mL." },
          { "q": "Which flour cup weighs most?", "choices": ["Scooped and packed", "Sifted", "Spooned and leveled"], "answer": 0, "explain": "Packing adds flour." },
          { "q": "A 200 g onion gives 180 g peeled. Yield?", "choices": ["90%", "80%", "110%"], "answer": 0, "explain": "180 ÷ 200." }
        ]
      },
      "knowledge": {
        "title": "Why weight beats volume; trim loss and buying enough",
        "minutes": 45,
        "body": [
          "A cup is a volume, and how much fits in it depends on how it's filled. A cup of flour can weigh anywhere from 120 to 150 grams; a cup of chopped onion varies more. A gram is a gram.",
          "That's why professional kitchens weigh. A scale gives the same result every time, in any hands, and it lets you scale a recipe by multiplication without converting cups and spoons.",